{
  "version": "v1",
  "event_id": "thumb-evt-001",
  "session_id": "sess-123",
  "request_id": "req-456",
  "artifact_id": "outline-001",
  "artifact_kind": "outline",
  "workflow_stage": "outline",
  "thumb": "up",
  "reason_codes": ["clear_structure", "audience_fit"],
  "actor": {
    "actor_type": "user",
    "actor_id": "user-123"
  },
  "created_at": "2026-04-28T12:00:00Z",
  "metadata": {
    "source": "web"
  }
}
